{
  "schema_version": 1,
  "id": "the-number-has-a-vintage",
  "route": "the-number-has-a-vintage.html",
  "category": "evidence-public-life",
  "form": "essay",
  "title": "The Number Has a Vintage",
  "summary": "An official jobs estimate changes as later data arrive. Each version answers a different question, and a fair comparison names which one it uses.",
  "author": "Zain Dana Harper",
  "published_at": "2026-10-01",
  "updated_at": "2026-10-01",
  "observed_at": "2026-10-01T11:08:21Z",
  "thesis": "An employment estimate should travel with its vintage, adjustment status, series definition and revision stage, because each version of the number answers a different question.",
  "opening": {
    "question": "When an official employment estimate is revised, what can its first and later versions establish, and when does a comparison stop being like for like?",
    "finding": "The first release records what was knowable at the time. Later releases can improve the historical series. Mixing those roles, or mixing adjustment basis and revision stage, can turn an ordinary revision into a false comparison.",
    "evidence": "Bureau of Labor Statistics revision policy, benchmark releases and methods pages for the national Current Employment Statistics survey, with the Philadelphia Fed real-time data set as an example of research by vintage.",
    "limit": "The March 2026 benchmark is preliminary until February 2027. Two benchmark years are examples and give no trend or accuracy score, and a revision alone says nothing about motive."
  },
  "sections": [
    {
      "id": "one-month",
      "heading": "One month, several official numbers",
      "paragraphs": [
        "On 28 August 2026 the U.S. Bureau of Labor Statistics published a preliminary benchmark revision for March 2026 total nonfarm payroll employment: minus 79,000, or minus 0.1 percent. The same release says the official establishment survey estimates were left unchanged by this preview. The final benchmark is scheduled for February 2027, with the January 2027 jobs report. So the number arrives with a status attached. It is an official preview of a level difference, and the official series has yet to absorb it. BLS preliminary benchmark, March 2026",
        "That status belongs beside the number whenever it is repeated. A jobs estimate is a value, and it is also a version: a particular release, at a particular stage, with a particular adjustment. Later releases can improve the historical series. The first release stays the right record of what people could know at the time. Confusing those roles is how an ordinary revision becomes a false comparison."
      ]
    },
    {
      "id": "revision-ladder",
      "heading": "Four ways the same month changes",
      "paragraphs": [
        "BLS describes its revisions as a balance between speed and accuracy. For the national Current Employment Statistics survey, a first estimate appears about three weeks after the reference month. It is revised in each of the next two monthly releases as more sample reports arrive, and then held until the annual benchmark. BLS revisions policy, CES questions and answers",
        "Once a year, the March level is re-anchored to counts drawn mainly from unemployment insurance tax records, which BLS says cover about 97 percent of employment in the survey's scope. Other sources estimate the rest. The months around March are then adjusted to the new level. Seasonal models are re-estimated each year as well, and seasonally adjusted figures can change for the previous five years. BLS can also reconstruct historical series when industry classifications, scope or data errors change. Under a new industry code structure, a series can be converted whole, combined with another, split, or published in less detail. CES questions and answers, CES methods: calculation, Industry classification overview",
        "Each mechanism changes a different part of the record. Later sample reports change one month's estimate. A benchmark changes a level and the months around it. Seasonal re-estimation changes the adjusted series. A reconstruction can change what a label covers."
      ]
    },
    {
      "id": "which-vintage",
      "heading": "Which release answers which question",
      "paragraphs": [
        "BLS publishes vintage tables that keep each value it released for a reference month, release by release, with the first and third estimates set beside a recent one. That design lets a reader answer two separate questions. What did the agency say at the time? What does the current history say now? CES vintage data",
        "Someone judging a forecast, a policy call or a news story made in June 2025 should use the information available in June 2025. A later benchmark can improve the history without giving that person information they never had. The Federal Reserve Bank of Philadelphia maintains a real-time data set of dated snapshots for this kind of work, described by Dean Croushore and Tom Stark in a 2001 journal article. Philadelphia Fed real-time data set, Croushore and Stark, 2001",
        "For the best current account of what happened to employment, the latest consistent vintage is usually the right input. Freezing a first estimate forever would throw away later sample reports and the wider benchmark counts. Neither vintage is the one true number. The question decides which vintage fits."
      ]
    },
    {
      "id": "comparisons",
      "heading": "How a comparison quietly breaks",
      "paragraphs": [
        "The March 2025 benchmark shows how many official numbers can describe one month. The preliminary benchmark, released on 9 September 2025, found the benchmark count 911,000 below the survey's not seasonally adjusted estimate, a gap of 0.6 percent. The final benchmark revision, released on 11 February 2026, put that gap at 861,000, or 0.5 percent, on the same basis. Measured against the sample-based estimate published before the benchmark, the total not seasonally adjusted revision was minus 862,000. The seasonally adjusted March level fell by 898,000 in the revision, or 0.6 percent. Figure 1 sets these records side by side. BLS preliminary benchmark, March 2025, CES benchmark article, March 2025, CES benchmark technical notes",
        "The 50,000 gap between the preliminary and final not seasonally adjusted benchmarks is a change between two stages of measurement. It records no new hiring or layoffs. The 1,000 gap between the 861,000 and 862,000 figures comes from a reconstruction of two banking series, which lowered the March 2025 estimate by 1,000 before benchmarking. A seasonally adjusted figure cannot stand in for an unadjusted one, because seasonal processing is a separate step.",
        "Other mismatches are common. A benchmark changes a level, and a level change is a different quantity from one month's payroll gain. A forecast judged against today's revised history is held to information it never had. A series label can stay the same while a reconstruction changes what it covers. Summary statistics carry the same risk. The BLS table of monthly revisions reports a mean revision, which shows direction, and a mean absolute revision, which shows size. A mean near zero can hide large revisions that offset each other. The same table leaves out later benchmark, seasonal and other updates, so it cannot show how far first releases sit from the current history. CES monthly revisions table",
        "A revision alone does not establish fabrication, political interference or a directional bias. Planned revisions are part of the declared method. BLS describes the benchmark revision as the difference between two separately produced counts, each with its own errors. A claim of interference would need its own evidence. Revisions still deserve scrutiny, and that scrutiny needs a defined statistic and a like-for-like comparison. CES methods: calculation, BLS revisions policy"
      ]
    },
    {
      "id": "six-fields",
      "heading": "Six fields to carry with a public number",
      "paragraphs": [
        "A short practice follows from these mechanisms. When citing an official employment number, carry six fields: the series identity or exact label, the reference period, the value and its units, the adjustment status, the release date or vintage, and the revision stage. Add the source link, and when the value is preliminary, the date of the next scheduled revision. Figure 2 lists the question each field answers. The checklist is an editorial proposal drawn from these sources. BLS has not adopted it, and it has not been tested with readers.",
        "Matching all six fields makes two values comparable. It does not show that a comparison matters, that a change has a cause, or that either estimate is free of error. A revised number can be different and still legitimate. The useful question is which vintage answers the decision at hand, and whether the two values were measured the same way."
      ]
    }
  ],
  "sources": [
    {
      "id": "prebmk-2026",
      "title": "Current Employment Statistics Preliminary Benchmark (National), March 2026",
      "url": "https://www.bls.gov/news.release/archives/prebmk_08282026.htm",
      "publisher": "U.S. Bureau of Labor Statistics",
      "role": "Preliminary March 2026 benchmark, its status as a preview and the scheduled final revision",
      "published_at": "2026-08-28",
      "observed_at": "2026-10-01"
    },
    {
      "id": "prebmk-2025",
      "title": "Current Employment Statistics Preliminary Benchmark (National), March 2025",
      "url": "https://www.bls.gov/news.release/archives/prebmk_09092025.htm",
      "publisher": "U.S. Bureau of Labor Statistics",
      "role": "Preliminary March 2025 benchmark and its not seasonally adjusted basis",
      "published_at": "2025-09-09",
      "observed_at": "2026-10-01"
    },
    {
      "id": "benchmark-2025",